<?xml version="1.0" encoding="UTF-8"?><!--Sample XML file generated by XMLSPY v2004 rel. 3 U (http://www.xmlspy.com)--><Customer xmlns="http://cnl.wustl.edu/Sample" xmlns:xdat="C:\xdat\schemas\xdat.xsd" xmlns:xsi="http://www.w3.org/2001/XMLSchema-instance" xsi:schemaLocation="http://cnl.wustl.edu/SampleC:\xdat_versions\070805\projects\sample\schemas\sample.xsd">	<firstname>Johann</firstname>	<lastname>Smith</lastname>	<email>j.s@email.com</email>	<addresses active="true">		<street1>1 Fantasy Dr.</street1>		<city>Utopia</city>		<state>CA</state>		<zip>78945</zip>		<phone>800-987-9877</phone>	</addresses>	<orders>		<order order_date="2001-12-17T09:30:47-05:00">			<orderItems>				<orderItem>					<price_per>99.99</price_per>					<quantity>2</quantity>					<product ID="012675">						<name>Microsoft Office XP</name>						<manufacturer>Microsoft</manufacturer>					</product>				</orderItem>				<orderItem>					<price_per>109.99</price_per>					<quantity>1</quantity>					<product ID="012676">						<name>Microsoft Windows XP</name>						<manufacturer>Microsoft</manufacturer>					</product>				</orderItem>			</orderItems>			<billing_address active="true">				<street1>1 Fantasy Dr.</street1>				<city>Utopia</city>				<state>CA</state>				<zip>78945</zip>				<phone>800-987-9877</phone>			</billing_address>			<shipping_address active="true">				<street1>1 Fantasy Dr.</street1>				<city>Utopia</city>				<state>CA</state>				<zip>78945</zip>				<phone>800-987-9877</phone>			</shipping_address>		</order>		<order order_date="2001-12-17T09:30:47-05:00">			<orderItems>				<orderItem>					<price_per>99.99</price_per>					<quantity>5</quantity>					<product ID="012675">						<name>Microsoft Office XP</name>						<manufacturer>Microsoft</manufacturer>					</product>				</orderItem>				<orderItem>					<price_per>109.99</price_per>					<quantity>6</quantity>					<product ID="012676">						<name>Microsoft Windows XP</name>						<manufacturer>Microsoft</manufacturer>					</product>				</orderItem>			</orderItems>			<billing_address active="true">				<street1>1 Fantasy Dr.</street1>				<city>Utopia</city>				<state>CA</state>				<zip>78945</zip>				<phone>800-987-9877</phone>			</billing_address>			<shipping_address active="true">				<street1>1 Fantasy Dr.</street1>				<city>Utopia</city>				<state>CA</state>				<zip>78945</zip>				<phone>800-987-9877</phone>			</shipping_address>		</order>	</orders></Customer>